{
  "_id": "macro-recording:workflow-recording-fixture:recording-correlation-fixture",
  "documentType": "macro-recording",
  "schemaVersion": "1.0",
  "workflowId": "workflow-recording-fixture",
  "organizationId": "org-portfolio-demo",
  "correlationId": "recording-correlation-fixture",
  "recordedAt": "2026-08-19T12:00:00.000Z",
  "events": [
    {
      "eventId": "6f154798-1bbc-43e9-804c-1169d56a4a9",
      "type": "workflow.step.completed",
      "version": 2,
      "occurredAt": "2026-08-19T12:00:00.000Z",
      "redaction": "fields-removed",
      "payload": {
        "stepId": "evidence",
        "status": "completed",
        "evidenceReference": "evidence:fixture:1"
      }
    }
  ],
  "retention": "one-week"
}
